{
  "$schema": "http://json-schema.org/draft-07/schema#",
  "$id": "https://signaltrace.example/schema/message/v1",
  "title": "Synthetic Message",
  "description": "Schema for a synthetic communication message used in the SignalTrace CE examples.",
  "type": "object",
  "additionalProperties": false,
  "required": ["id", "timestamp", "sender", "receiver", "content"],
  "properties": {
    "id": {
      "type": "string",
      "description": "Unique identifier for the message. Must be synthetic and non-identifying."
    },
    "timestamp": {
      "type": "string",
      "format": "date-time",
      "description": "ISO 8601 timestamp indicating when the message was sent."
    },
    "sender": {
      "type": "string",
      "description": "Synthetic handle of the sender."
    },
    "receiver": {
      "type": "string",
      "description": "Synthetic handle of the receiver."
    },
    "content": {
      "type": "string",
      "description": "The body of the message. Should not contain real personal data."
    },
    "metadata": {
      "type": "object",
      "description": "Optional metadata with additional fields such as tags, channel or synthetic phone numbers.",
      "additionalProperties": true
    }
  }
}